{
  "id": "fn-for-now",
  "module": "function",
  "lemma": "for now",
  "zh": "暂时",
  "tags": [
    "time"
  ],
  "examples": [
    {
      "en": "Uncle, I can pass along your message — but as for meeting him in person, Gu Yan isn't available for now.",
      "zh": "大叔，话我可以帮你们带到，但是想要见面，孤烟暂时还不方便。",
      "source": "drama:english-vocab"
    }
  ],
  "freq": 34
}
