{
  "id": "fn-even",
  "module": "function",
  "lemma": "even",
  "zh": "甚至/连",
  "tags": [
    "priority",
    "degree"
  ],
  "examples": [
    {
      "en": "I promise I won't help you.\" \"You didn't even go to the hospital — how do you know which medicine to buy?",
      "zh": "我保证不帮你。」「你都没去医院，怎么知道买什么药？",
      "source": "drama:english-vocab"
    }
  ],
  "freq": 735
}
