{
  "id": "fn-let",
  "module": "function",
  "lemma": "let",
  "zh": "让",
  "tags": [
    "verb"
  ],
  "examples": [
    {
      "en": "The three words that waste the most feelings and experience are: I can't let go.",
      "zh": "最浪费感情和经历的三个字，就是舍不得。",
      "source": "drama:english-vocab"
    }
  ],
  "freq": 709
}
